{
  "$schema": "http://json-schema.org/draft-04/schema#",
  "id": "http://uk.gov.moj.cpp/staging/prosecutors/json/schemas/stagingprosecutors.cps-ptph-received-details.json",
  "type": "object",
  "properties": {
    "submissionId": {
      "$ref": "http://justice.gov.uk/domain/core/common/definitions.json#/definitions/uuid"
    },
    "submissionStatus": {
      "type": "string",
      "enum": [
        "PENDING",
        "FAILED",
        "REJECTED",
        "SUCCESS",
        "SUCCESS_WITH_WARNINGS",
        "EXPIRED"
      ]
    },
    "prosecutionCaseSubject": {
      "type": "object",
      "properties": {
        "urn": {
          "type": "string",
          "minLength": 1
        },
        "prosecutingAuthority": {
          "type": "string",
          "description": "The OU Code of the prosecuting authority"
        }
      },
      "required": [
        "urn",
        "prosecutingAuthority"
      ],
      "additionalProperties": false
    },
    "cpsDefendant": {
      "description": "Identifies the defendant and offences to which the form is associated to",
      "type": "array",
      "items": {
        "type": "object",
        "properties": {
          "matchingId": {
            "description": "This is randomly generated id for processing only",
            "$ref": "http://justice.gov.uk/domain/core/common/definitions.json#/definitions/uuid"
          },
          "prosecutorDefendantId": {
            "description": "A unique reference to a defendant within a prosecution. Provided by the prosecuting authority e.g. DWP",
            "type": "string",
            "maxLength": 36
          },
          "cpsDefendantId": {
            "description": "A unique reference to a defendant within a prosecution. Provided by cps when CPS are prosecuting the case",
            "type": "string",
            "maxLength": 36
          },
          "asn": {
            "description": "A unique reference to a defendant within a prosecution. Provided by the police force and requested from the police by a non police prosecutor e.g. DWP requests from the police",
            "type": "string",
            "maxLength": 21
          },
          "title": {
            "description": "Title by which a defendant is addressed",
            "type": "string"
          },
          "forename": {
            "description": "The first given name of a defendant",
            "type": "string",
            "maxLength": 35
          },
          "forename2": {
            "description": "The second given name of a defendant",
            "type": "string",
            "maxLength": 35
          },
          "forename3": {
            "description": "The third given name of a defendant",
            "type": "string",
            "maxLength": 35
          },
          "surname": {
            "description": "Surname or Family name",
            "type": "string",
            "maxLength": 35
          },
          "dateOfBirth": {
            "description": "The date when the defendant was born",
            "$ref": "http://justice.gov.uk/domain/core/common/definitions.json#/definitions/date"
          },
          "organisationName": {
            "description": "The name of a defendant that is a legal entity",
            "type": "string"
          },
          "parentGuardianForYouthDefendants": {
            "$ref": "http://cpp.moj.gov.uk/staging/prosecutors/json/schemas/defendant-parent-guardian.json"
          },
          "localAuthorityDetailsForYouthDefendants": {
            "$ref": "http://cpp.moj.gov.uk/staging/prosecutors/json/schemas/local-authority-details-for-youth-defendants.json"
          },
          "principalCharges": {
            "type": "string"
          }
        }
      }
    },
    "tag": {
      "type": "string"
    },
    "ptphAdvocate": {
      "$ref": "http://cpp.moj.gov.uk/staging/prosecutors/json/schemas/cps-case-contact.json"
    },
    "trialAdvocate": {
      "$ref": "http://cpp.moj.gov.uk/staging/prosecutors/json/schemas/cps-case-contact.json"
    },
    "reviewingLawyer": {
      "$ref": "http://cpp.moj.gov.uk/staging/prosecutors/json/schemas/cps-case-contact.json"
    },
    "prosecutionCaseProgressionOfficer": {
      "$ref": "http://cpp.moj.gov.uk/staging/prosecutors/json/schemas/cps-case-contact.json"
    },
    "officerInTheCase": {
      "$ref": "http://cpp.moj.gov.uk/staging/prosecutors/json/schemas/cps-case-contact.json"
    },
    "cpsOffice": {
      "type": "string"
    },
    "draftIndictment": {
      "type": "string"
    },
    "draftIndictmentNotes": {
      "type": "string"
    },
    "summaryOfCircumstances": {
      "type": "string"
    },
    "summaryOfCircumstancesNotes": {
      "type": "string"
    },
    "statementsForPAndICm": {
      "type": "string"
    },
    "statementsForPAndICmNotes": {
      "type": "string"
    },
    "exhibitsForPAndICm": {
      "type": "string"
    },
    "exhibitsForPAndICmNotes": {
      "type": "string"
    },
    "cctv": {
      "type": "string"
    },
    "cctvNotes": {
      "type": "string"
    },
    "streamlinedForensicReport": {
      "type": "string"
    },
    "streamlinedForensicReportNotes": {
      "type": "string"
    },
    "medicalEvidence": {
      "type": "string"
    },
    "medicalEvidenceNotes": {
      "type": "string"
    },
    "expertEvidence": {
      "type": "string"
    },
    "expertEvidenceNotes": {
      "type": "string"
    },
    "badCharacter": {
      "type": "string"
    },
    "badCharacterNotes": {
      "type": "string"
    },
    "hearsay": {
      "type": "string"
    },
    "hearsayNotes": {
      "type": "string"
    },
    "specialMeasures": {
      "type": "string"
    },
    "specialMeasuresNotes": {
      "type": "string"
    },
    "criminalRecord": {
      "type": "string"
    },
    "criminalRecordNotes": {
      "type": "string"
    },
    "victimPersonalStatement": {
      "type": "string"
    },
    "victimPersonalStatementNotes": {
      "type": "string"
    },
    "disclosureManagementDoc": {
      "type": "string"
    },
    "disclosureManagementDocNotes": {
      "type": "string"
    },
    "thirdParty": {
      "type": "string"
    },
    "thirdPartyNotes": {
      "type": "string"
    },
    "reviewDisclosableMaterial": {
      "type": "string"
    },
    "reviewDisclosableMaterialNotes": {
      "type": "string"
    },
    "particularsOfAnyRelatedCriminalProceedings": {
      "type": "string"
    },
    "particularsOfAnyFamily": {
      "type": "string"
    },
    "witnesses": {
      "description": "To provide prosecution witnesses",
      "type": "array",
      "items": {
        "$ref": "http://cpp.moj.gov.uk/staging/prosecutors/json/schemas/witness-ptph.json"
      }
    }
  },
  "required": [
    "submissionId",
    "submissionStatus",
    "prosecutionCaseSubject",
    "cpsDefendant",
    "ptphAdvocate",
    "reviewingLawyer",
    "prosecutionCaseProgressionOfficer",
    "officerInTheCase",
    "cpsOffice",
    "draftIndictment",
    "summaryOfCircumstances",
    "statementsForPAndICm",
    "exhibitsForPAndICm",
    "cctv",
    "streamlinedForensicReport",
    "medicalEvidence",
    "expertEvidence",
    "badCharacter",
    "hearsay",
    "specialMeasures",
    "criminalRecord",
    "victimPersonalStatement",
    "disclosureManagementDoc",
    "thirdParty",
    "reviewDisclosableMaterial"
  ],
  "additionalProperties": false
}